question,timestamp,model_llama3-70b-8192,model_mixtral-8x7b-32768,model_deepseek-r1-distill-qwen-32b,model_qwen-2.5-32b
"A university employee reports their smartphone containing university email was stolen while traveling. According to principles in policies like WPI's, what is the correct sequence of actions?",2025-03-20 12:20:23,"A timely question!

According to principles in policies like WPI's (Worcester Polytechnic Institute), the correct sequence of actions when a university employee reports their smartphone containing university email was stolen while traveling is:

1. **Immediate Reporting**: The employee must immediately report the incident to the university's IT department or designated incident response team. This helps prevent potential data breaches and minimizes the risk of unauthorized access to university email and data.
2. **Remote Wipe (if possible)**: If the device is configured to allow remote wipe, the IT department may attempt to remotely wipe the device to remove sensitive university data, including email, contacts, and other confidential information.
3. **Change Passwords**: The employee must change their university email password and any other passwords that may have been stored on the device to prevent unauthorized access.
4. **Notify Supervisors and Colleagues**: The employee should notify their supervisors and colleagues about the incident, so they are aware of the situation and can take necessary precautions.
5. **Conduct a Risk Assessment**: The IT department, in collaboration with the employee, will conduct a risk assessment to determine the potential impact of the stolen device on university data and systems.
6. **Take Additional Measures (if necessary)**: Depending on the risk assessment, additional measures may be taken, such as monitoring university email and systems for suspicious activity, resetting access to sensitive systems, or notifying affected parties.
7. **Document the Incident**: The incident should be thoroughly documented","Here is a general sequence of actions that aligns with the principles found in many university policies, such as WPI's, when a university employee reports that their smartphone containing university email has been stolen:

1. Report the theft to local law enforcement: The employee should file a police report to document the stolen property. This may help in tracking down the device and could be useful for insurance purposes.
2. Notify the university's IT department: The employee should immediately inform the university's IT or Information Security department about the theft. This will allow the IT department to take appropriate action to protect university data, such as remotely wiping the device to prevent unauthorized access.
3. Change passwords and enable multi-factor authentication: The employee should change their university email password and enable multi-factor authentication if not already enabled. This will help prevent unauthorized access to the university email account.
4. Notify affected parties: If there is sensitive or confidential information in the university email account, the employee should notify the affected parties about the potential data breach. The university's IT or Information Security department may be able to help identify the affected parties and determine the appropriate communication channels.
5. Monitor accounts and credit: The employee should monitor their university email account and personal financial accounts for any suspicious activity. If they notice any unauthorized access or fraudulent charges, they should report it to the university's IT department and the appropriate financial institutions.","<think>
Okay, so I'm trying to figure out what the correct sequence of actions should be if a university employee's smartphone, which has their university email, gets stolen while they're traveling. I know that universities like WPI have policies in place for such situations, but I'm not exactly sure about the steps involved. Let me think this through step by step.

First, when someone realizes their phone is stolen, the immediate reaction is panic, but they need to act quickly and methodically. The first thing that comes to mind is notifying the authorities. So, they should probably contact local law enforcement where they are. But since they're traveling, maybe the process is a bit different. I'm not sure if they should report it to the local police or just their university's security.

Next, they need to secure their accounts. Their smartphone has university email, so they should immediately change their passwords to prevent unauthorized access. But how do they do that without their phone? Maybe they can use another device or the university's website. Also, they should consider logging out of all their accounts, but again, without access to the phone, this might be tricky.

Then, I think about the IT department. They must have procedures in place for such incidents. So, the employee should contact the IT support team as soon as possible to report the theft. They can assist in securing the email account and possibly removing access from the stolen device. I'm not exactly sure what specific steps IT would take","When a university employee reports that their smartphone, which contains university email, has been stolen while traveling, the correct sequence of actions according to principles in policies like WPI's (Worcester Polytechnic Institute) would typically be as follows:

1. **Immediate Reporting**: The employee should immediately report the theft to the appropriate university authorities, such as the IT support or security department, and to local law enforcement where the theft occurred.

2. **Change Passwords and Security Measures**: The employee should promptly change all passwords for university accounts, including email, and enable or reconfigure two-factor authentication (2FA) to prevent unauthorized access.

3. **Remote Wipe (if possible)**: If the smartphone is managed by the university or has remote wipe capabilities, the IT department should initiate a remote wipe of the device to protect any sensitive information.

4. **Notify Supervisors and IT Security**: Inform immediate supervisors and the IT security team about the incident, providing details such as the device type, last known location, and any university data that might have been accessed or stored on the device.

5. **Incident Report**: Fill out an incident report as required by university policy. This report should detail the incident, the steps taken, and the type of data that might have been compromised.

6. **Risk Assessment and Mitigation**: Collaborate with the IT security team to conduct a risk assessment to determine the potential impact of the lost device and any necessary mitigation steps, such as monitoring for unauthorized"
