question,timestamp,model_Zero Shot_llama3-70b-8192,model_Zero Shot_deepseek-r1-distill-qwen-32b
Tab2 - Zero Shot - 📂 Data Ownership Scenario,2025-03-21 02:50:22,Yes,"<think>
Okay, I need to help the user determine if allowing their team to store work emails on their devices for up to three months complies with their Mobile Device Management (MDM) policy. The user wants a yes or no answer, so I'll have to figure that out based on general MDM principles.

First, I should consider what MDM policies typically cover. MDM usually involves security measures, device management, data protection, and compliance with organizational standards. These policies are put in place to ensure that company data is secure and that employees are using their devices responsibly.

One key aspect is data retention. Storing emails for three months could be acceptable if the MDM policy allows for a certain period of data retention. However, the exact timeframe might vary depending on the company's specific policy. Some companies might have a shorter retention period, especially if dealing with sensitive information.

Another factor is encryption and data protection. Even if the emails are stored locally on devices, they should be encrypted to prevent unauthorized access. If the MDM policy requires encryption, this would be a necessary condition for allowing such storage.

Also, device security measures like passcodes, biometric authentication, and remote wiping should be in place to protect against data loss or theft. If these measures are in compliance with the MDM policy, it supports allowing the storage.

Another point is whether the company has a Bring Your Own Device (BYOD) policy, which may have different rules compared to company-provided devices. The policy might allow some flexibility, but it's crucial to ensure that all security requirements are met.

Additionally, the email content itself should be compliant with other policies, like data privacy laws (e.g., GDPR) and confidentiality agreements. If the emails contain sensitive or personally identifiable information, the retention period and storage methods must adhere to those regulations.

I should also think about the purpose of allowing this storage. The user mentioned referencing older communications, which implies that it's for work-related productivity. This makes the request more justifiable compared to non-work reasons.

However, if the MDM policy strictly prohibits storing emails beyond a certain period, then the answer would be no. Without knowing the exact terms of their policy, I can't be 100% certain, but based on standard MDM practices, it's likely permissible as long as security measures are in place.

Therefore, considering all these factors—data retention periods, encryption, device security, and policy alignment—it seems reasonable to allow storing work emails for three months on devices. But the user should consult their specific MDM policy or IT department to confirm.
</think>

Yes, allowing your team to store work emails on their devices for up to three months is generally permissible under Mobile Device Management (MDM) policies, provided that security measures such as encryption, device passcodes, and data protection are in compliance with your organization's guidelines. It's advisable to consult your specific MDM policy or IT department for confirmation."
