question,timestamp,model_llama3-70b-8192,model_mixtral-8x7b-32768,model_deepseek-r1-distill-qwen-32b
"A university IT administrator discovers that a faculty member has installed a custom operating system on their university-provided smartphone. According to best practices aligned with WPI's Mobile Device Management Policy, what should happen next?",2025-03-20 12:31:51,"According to standard Mobile Device Management (MDM) policies, similar to WPI's, when a personal device is used to access university email, the university typically has rights to the email data on the device. Here's a breakdown:

1. **University ownership of email data**: As the professor used their personal smartphone to access university email, the email data itself belongs to the university. This is because the email account is a university-provided resource, and the data contained within is likely to be related to university business, research, or other official activities.
2. **MDM policy implications**: WPI's MDM policy (and similar policies elsewhere) usually include provisions that allow the university to:
	* Remotely wipe or remove university data from the device when an employee leaves the institution.
	* Monitor and manage university data on personal devices, as long as the device is used for university business.
	* Ensure that university data is protected and secured according to institutional policies and standards.
3. **Research communications as university data**: Since the professor used their personal smartphone to access university email, it's likely that important research communications are stored on the device. These communications are considered university data, as they relate to research conducted while the professor was employed by the university.
4. **Professor's obligations**: As the professor is leaving the institution, they may be obligated to:
	* Return or remove university data from their personal device, including email communications related to research.
	* Cooperate with","Based on standard Mobile Device Management (MDM) policies, such as those used by Worcester Polytechnic Institute (WPI), the email data on the device belongs to the university and not the individual research professor. This is because the email account was accessed through the professor's personal smartphone, but it is still a university-owned asset and the data within it is considered the property of the university. The university would have the right to access and manage the email data on the device, and would need to transfer the data to another location or device as part of the professor's departure. It's also important to note that any data stored on the device should be in compliance with the university's data retention policy.","<think>
Okay, so I'm trying to figure out who has the rights to the email data on the professor's personal smartphone. The professor used their own phone to access university emails over the past five years and is now leaving for another institution. The phone contains important research communications.

First, I need to consider the standard Mobile Device Management (MDM) policies, similar to WPI's. From what I remember, MDM policies usually allow universities to manage devices that access their systems, whether they're university-provided or personal devices. So, the university likely has some rights over the data accessed via their email services.

But the phone is personal, so that complicates things. The professor owns the phone, but they used it to access university emails. I think the university probably has ownership of the emails themselves because they are university communications. However, the device is the professor's property, so the data's physical storage is on their phone.

I'm also wondering about the policies regarding data ownership. Typically, universities own the intellectual property and data related to their operations, including emails. So even if the professor used a personal device, the emails are the university's property. But the professor might have rights to the data since they were accessing it as part of their job duties and the data is important for their research.

There's also the aspect of how the university handles data migration. When an employee leaves, the university might require that all university data, including emails, be transferred to a university"
